{
  "schemaVersion": "profile-facts/1",
  "contentRelease": {
    "id": "CR-0",
    "status": "approved",
    "russelVisa": "2026-10-20"
  },
  "sources": [
    {
      "id": "russel-2026-10-19",
      "kind": "owner-declaration",
      "label": "Réponses de Russel dans la fiche de collecte G1",
      "checkedAt": "2026-10-19"
    }
  ],
  "facts": {
    "publicName": {
      "value": "MASTERMIND",
      "sources": [
        "russel-2026-10-19"
      ],
      "validatedAt": "2026-10-20",
      "visibility": "public",
      "rightsOwner": "Russel (MASTERMIND)"
    },
    "title": {
      "value": "Software Engineer",
      "sources": [
        "russel-2026-10-19"
      ],
      "validatedAt": "2026-10-20",
      "visibility": "public",
      "rightsOwner": "Russel (MASTERMIND)"
    },
    "currentPosition": {
      "value": {
        "title": "Développeur Full Stack",
        "organization": "BatobayeMarket",
        "city": "Douala",
        "since": "2025-11-18",
        "focus": "Maintenance et mises à jour à dominante backend"
      },
      "sources": [
        "russel-2026-10-19"
      ],
      "validatedAt": "2026-10-20",
      "visibility": "public",
      "rightsOwner": "Russel (MASTERMIND)"
    },
    "base": {
      "value": {
        "city": "Douala",
        "country": "Cameroun"
      },
      "sources": [
        "russel-2026-10-19"
      ],
      "validatedAt": "2026-10-20",
      "visibility": "public",
      "rightsOwner": "Russel (MASTERMIND)"
    },
    "email": {
      "value": "russelfotie777@gmail.com",
      "sources": [
        "russel-2026-10-19"
      ],
      "validatedAt": "2026-10-20",
      "visibility": "public",
      "rightsOwner": "Russel (MASTERMIND)"
    },
    "github": {
      "value": "https://github.com/russelfotie777-source",
      "sources": [
        "russel-2026-10-19"
      ],
      "validatedAt": "2026-10-20",
      "visibility": "public",
      "rightsOwner": "Russel (MASTERMIND)"
    },
    "availability": {
      "value": "En poste, ouvert aux opportunités",
      "sources": [
        "russel-2026-10-19"
      ],
      "validatedAt": "2026-10-20",
      "visibility": "public",
      "rightsOwner": "Russel (MASTERMIND)"
    },
    "siteLanguages": {
      "value": [
        "fr"
      ],
      "sources": [
        "russel-2026-10-19"
      ],
      "validatedAt": "2026-10-20",
      "visibility": "public",
      "rightsOwner": "Russel (MASTERMIND)"
    }
  }
}
